;Mesure;Estimation  (en Md€);Commentaire
0;Sous-indexation 2015 des pensions AGIRC-ARRCO;0.0;Aucune économie acquise en raison de l’inflation nulle en 2015
1;Décalage de la revalorisation des pensions d'avril à octobre, et mesure cumul emploi-retraite;0.1;Aucune économie sur le décalage tant que l’inflation reste nulle
2;Non revalorisation des prestations sociales indexées (dont pensions de retraite) avant octobre 2015;0.0;Aucune économie acquise en raison de la faible inflation
3;Étalement de la montée en charge de la réforme de la dépendance;0.0;L’étalement d’une montée en charge d’une mesure décidée par le Gouvernement ne correspond pas à une vraie économie.
4;Mesures d'économies sur la politique familiale (prime de naissance, congé parental, modulation des allocations…);0.8;Chiffrage à partir des évaluations préalables des différents projets de loi.
5;Réforme du capital décès;0.2;Chiffrage à partir de l’évaluation préalable du PLFSS pour 2015.
6;Mesures en gestion (ralentissement des dépenses de gestion des organismes de protection sociale et des fonds d'action sanitaire et sociale, et mesures de lutte contre la fraude aux prestations sociales);0.5;Écart entre les dépenses de gestion 2015 et ce que la CCSS de juin 2014 prévoyait. Il y a une vraie difficulté à évaluer les économies de gestion administrative en dehors de mesures clairement identifiées et quantifiables. Par ailleurs, il n’y a pas d’inflexion significative des dépenses de fonctionnement des régimes, selon le compte provisoire de l’Insee.
